,sighted_timestamp,city,state,country,shape,duration_seconds,duration_mins,comments,date_posted,latitude,longitude
1840,9/5/2004 00:43,tess corners,wi,us,formation,420.0,6-7 min,Bright Lights in formation,9/9/2004,42.9222222,-88.0994444
1841,9/5/2004 02:00,johnson city,tn,us,fireball,20.0,under 2 seconds,Shooting star?,9/9/2004,36.3133333,-82.3536111
1842,9/5/2004 03:28,ocean city,md,us,unknown,600.0,10min,The crafts are not moveing and have flickering lights,9/9/2004,38.336388899999996,-75.0852778
1843,9/5/2004 11:30,lewisville,tx,us,oval,900.0,15 min,long oval cloud with red light in the exact middle,7/5/2008,33.046111100000005,-96.9938889
1844,9/5/2004 13:00,bainbridge island,wa,,sphere,900.0,10-15 min.,high flying ball of light slowly traveling approx. 72&#186; west to east.,9/9/2004,47.626208,-122.521245
1845,9/5/2004 19:30,murrieta,ca,us,other,120.0,2 minutes,Flying Spider,9/9/2004,33.5538889,-117.21305559999999
1846,9/5/2004 22:00,san francisco,ca,us,light,20.0,15-20 sec,Satellite-like light in night sky making unexpected direction and speed changes,9/29/2004,37.775,-122.41833329999999
1847,9/5/2004 22:10,hidalgo,tx,us,fireball,15.0,15 seconds,Fireball flying over deep south Texas.,9/29/2004,26.1,-98.2627778
1848,9/5/2004 22:30,brackettville,tx,us,fireball,2.0,2 seconds,large orange ball with green tail turning into an orange tail,9/29/2004,29.310277799999998,-100.4175
1849,9/5/2004 23:10,titusville,pa,us,light,180.0,3 minutes,Bright object traveling NE to SW,10/27/2004,41.6269444,-79.67388890000001
1850,9/5/2005 04:37,new york city (brooklyn),ny,us,light,20.0,20 sec,Early morning Labor Day&#44 I was sitting on my front step looking at the stars. I focused on 3 stars in a triangular format. That&#39s when,10/11/2005,40.7141667,-74.0063889
1851,9/5/2005 10:30,mount washington,ky,us,disk,25.0,20 to 25 seconds,I saw a metallic disk over the shoulder of a realestate agent in the distance in Mt. Washington&#44KY on 9-5-05,3/4/2008,38.05,-85.5458333
1852,9/5/2005 13:30,eugene,or,us,light,1.0,1m. 10sec.,Video on infrared records something,9/15/2005,44.0522222,-123.08555559999999
1853,9/5/2005 19:55,las vegas,nv,us,,300.0,5 minutes,Three bright craft traveling at immense speeds at impossible trajectory variants displaying some type of cloaking capability.,10/11/2005,36.175,-115.1363889
1854,9/5/2005 20:00,fife (uk/england),,gb,light,18000.0,5 hours,reflected cloud white glowing lights randomly apearing and spinning around a center piont and reversing,10/11/2005,56.25,-3.166667
1855,9/5/2005 20:18,simi valley,ca,us,light,10.0,10 seconds,Blue Dot like light,10/11/2005,34.2694444,-118.78055559999999
1856,9/5/2005 21:00,arlington,tx,us,fireball,60.0,around one minute,A  distant explosive sound as the area around me turned deep blue  for a second and then I witnessed two bright lights in the sky.,8/14/2007,32.735555600000005,-97.1077778
1857,9/5/2005 22:15,bothell,wa,us,light,240.0,4 minutes,Star-like object changing luminosity while meandering from SE to NW direction before vanishing,10/11/2005,47.7625,-122.20416670000002
1858,9/5/2005 22:47,wendover,ut,us,cigar,30.0,30 secs,We were headed on 80east heading east and we saw this very bright flashing light that just sat in the sky,10/11/2005,40.7372222,-114.03666670000001
1859,9/5/2005 23:30,summerville,sc,us,triangle,120.0,1-2 min,My 2 children and I were heading out to the store.  We live near an air force base so we constantly watch the skies for odd aircraft.,10/11/2005,33.0183333,-80.1758333
1860,9/5/2006 05:25,firestone/frederick,co,,flash,30.0,30 seconds,FOUR BRIGHT CAMERA LIKE FLASHES IN DIFFERENT AREAS,10/30/2006,40.093108,-104.930419
1861,9/5/2006 17:00,livingston,tn,us,light,120.0,1-2 minutes,Brilliant white light seen in the night sky over a rural area in Tennessee,10/30/2006,36.3833333,-85.3230556
1862,9/5/2006 19:35,mar vista (west los angeles),ca,us,light,20.0,20 seconds,Two of us witnessed a horizontal pulsating red light moving south at low altitude and low speed and then disappeared.,10/30/2006,34.0047222,-118.43
1863,9/5/2006 21:00,gila bend,az,us,fireball,600.0,10 minutes,Amber lights in southern night sky near Gila Bend&#44 AZ.  ((NUFORC Note:  Possible military flares at Gila Bend firing range??  PD)),10/30/2006,32.9477778,-112.7161111
1864,9/5/2006 21:00,fairborn,oh,us,triangle,30.0,about 30 seconds,Black Triangle Clearly Spotted In Ohio,6/12/2007,39.8208333,-84.0194444
1865,9/5/2006 21:00,clarksville (fort campbell),ky,,triangle,240.0,4 minutes,triangle ufo low flying for 4 minutes and then was gone,10/30/2006,36.529771000000004,-87.359453
1866,9/5/2006 21:00,el cajon,ca,us,formation,30.0,30 seconds,sting ray shaped objects fly in formation over el cajon,10/30/2006,32.7947222,-116.96166670000001
1867,9/5/2006 21:30,ontario,ca,us,light,600.0,5-10 minutes,Bright Orange light moving across the sky Eastward vieiwing from Ontario&#44 CA.,10/30/2006,34.0633333,-117.65
1868,9/5/2006 21:58,san jose,ca,us,light,5.0,5 seconds,strange bright light in north east sky,10/30/2006,37.3394444,-121.8938889
1869,9/5/2007 00:05,salem,or,us,rectangle,1800.0,30 minutes,A large&#44 bright orange rectangle appeared in front of the mountains&#44 changed shape and produced orbs.,11/28/2007,44.9430556,-123.0338889
1870,9/5/2007 12:00,mansfield,oh,us,sphere,60.0,60 seconds,Two small flying steel spheres,3/4/2008,40.7583333,-82.5155556
1871,9/5/2007 13:00,alton,nh,us,cigar,60.0,1 minutes,Possible Missile Test.,10/8/2007,43.4522222,-71.2180556
1872,9/5/2007 21:00,cedar falls,ia,us,light,3.0,2 - 3 seconds,Last Wednesday or Thursday&#44 about 9 PM&#44 I looked out my living room window and saw a ball of light streak across the sky. It was fairly,10/8/2007,42.5277778,-92.4452778
1873,9/5/2007 21:15,reno,nv,us,changing,120.0,2minutes,On our vacation my husband and myself were outside on the hotel balcony&#44 where we saw 4 objects rise from a distant mountain. They had,10/8/2007,39.5297222,-119.81277779999999
1874,9/5/2007 22:00,maple ridge (canada),bc,ca,circle,3600.0,1 hour approx.,Green and blue lights over Maple Ridge&#44 BC,10/8/2007,49.25,-122.5
1875,9/5/2007 23:40,hondo,tx,us,formation,15.0,15 seconds,Arc-shaped craft / formation of lights moving at very high speed East to West at low altitude,10/8/2007,29.3472222,-99.14111109999999
1876,9/5/2007 23:55,roswell,nm,us,changing,15.0,10-15 seconds,dim lights moving in u shaped formation over Roswell,10/8/2007,33.3941667,-104.5225
1877,9/5/2008 01:20,southlake,tx,us,unknown,6.0,6 sec,A white wavy oval that is fast moving and silent seen by two people.,10/31/2008,32.9411111,-97.1338889
1878,9/5/2008 02:50,jeannette,pa,us,circle,30.0,30 seconds,Orange globe moving slow just fazed out.,10/31/2008,40.328055600000006,-79.6155556
1879,9/5/2008 19:30,port st. lucie,fl,,light,8.0,8 seconds,I saw a bright light in the sky that did not move and suddenly vanished.,10/31/2008,27.273049,-80.358226
1880,9/5/2008 20:18,mesa,az,us,changing,600.0,10 min,Five very bright&#44 solid yellowish&#44 to golden lights that changed shape and format.,10/31/2008,33.4222222,-111.8219444
1881,9/5/2008 20:45,pecos,tx,us,circle,180.0,3 min,((HOAX??))  i was at work and a friend of mine had recorded it i was working at a prison and i was the recreation officer at the time,12/12/2009,31.4227778,-103.4927778
1882,9/5/2008 21:00,laguna woods,ca,us,circle,1800.0,30 mins,Circular Ring having blinking colored lights&#44 hovering&#44 doing roller-coaster type dips&#44 turns&#44 climbs.  (( Model airplane.)),10/31/2008,33.6102778,-117.72444440000001
1883,9/5/2008 23:00,pine bluff,ar,us,formation,40.0,40s,There was a glowing V-shaped formation flying very high and very fast.,10/31/2008,34.228333299999996,-92.0030556
1884,9/5/2008 23:00,sydney (canada),ns,ca,unknown,300.0,5mins,three ships high in orbit triangle formation,10/31/2008,46.15,-60.166667000000004
1885,9/5/2008 23:10,murrieta,ca,us,light,600.0,10 mins,extremely rapiding blinking red light meets with other&#44  then both go back from original spotted location.,10/31/2008,33.5538889,-117.21305559999999
1886,9/5/2008 23:10,san diego,ca,us,circle,180.0,3 minutes,Two fireballs in the night sky in San Diego,10/31/2008,32.7152778,-117.1563889
1887,9/5/2009 04:30,newark,de,us,triangle,2400.0,40 min,Orange-ish array of lights cruising over I-95 in Delaware,12/12/2009,39.6836111,-75.75
1888,9/5/2009 04:30,spokane (near),wa,us,other,1800.0,30 minutes,My wife&#44 son and myself were going to Spokane Washington to look at some houses that we were going to buy during the first week of this,12/12/2009,47.658888899999994,-117.425
1889,9/5/2009 08:40,fair oaks,ca,us,oval,5.0,5 seconds,Shinny disks in the sky.,12/12/2009,38.644722200000004,-121.2711111
1890,9/5/2009 09:30,corpus christi,tx,us,other,240.0,4 min.,1 Star shaped&#44 dark color&#44 moving slow&#44 making no noise&#44 cloudy morning&#44 moving eratic,12/12/2009,27.8002778,-97.39611109999998
1891,9/5/2009 12:10,glendora,ca,us,sphere,240.0,4 min,Silver Sphere over looking California wild fires,12/12/2009,34.1361111,-117.86444440000001
1892,9/5/2009 19:20,la crosse,wi,us,light,1.0,second,Extremely bright white light that I captured on camera over the city of La Crosse WI,12/12/2009,43.8013889,-91.2394444
1893,9/5/2009 20:00,terre haute,in,us,fireball,600.0,10 minutes,I dont know what it was. But it looked like something on fire streaking through the sky. It was just like watching a plane go by but wi,12/12/2009,39.466666700000005,-87.4138889
1894,9/5/2009 20:23,aurora,co,us,unknown,120.0,2 min,Craft moving from N to S later Flash in sky like star going nova,12/12/2009,39.7294444,-104.83138890000001
1895,9/5/2009 20:30,lake ggaston,nc,,fireball,60.0,1 min,Fireball that hovered then took off in an upward diagnal at a high speed over the lake.,12/12/2009,36.507621,-77.945309
1896,9/5/2009 20:30,lodi,nj,us,fireball,180.0,3 minutes,Red glowing object over south eastern sky in Lodi Nj on 9/5/2009,12/12/2009,40.8822222,-74.08361109999998
1897,9/5/2009 20:45,harrison twp.,mi,,circle,90.0,90 sec,Low flying unidentifiable orange object with orange haze,12/12/2009,42.583595,-82.82934200000001
1898,9/5/2009 20:47,rochester (greece),ny,us,circle,300.0,5 minutes,Orange objects in sky,12/12/2009,43.1547222,-77.61583329999999
1899,9/5/2009 21:00,riverside,ia,us,teardrop,120.0,2 minutes times 2,Two Slow Flying Fireballs Within Seven Minutes,12/12/2009,41.4797222,-91.58111109999999
1900,9/5/2009 21:05,penfield,pa,us,sphere,120.0,2 minutes,Bright orange non-blinking ball,12/12/2009,41.2083333,-78.5758333
1901,9/5/2009 21:11,kent (uk/england),,gb,circle,90.0,90 seconds,seven circle bright objects travelling slowly at estimated 1000ft three,12/12/2009,51.25,0.75
1902,9/5/2009 21:15,bangor,me,us,light,1500.0,25 minutes,Small star-like white light seen 3 separate times&#44 seach time changing direction&#44 travelling straight&#44 and ascending until out of view.,12/12/2009,44.8011111,-68.7783333
1903,9/5/2009 21:22,monroe,oh,us,light,60.0,1 minute,My wife and I were driving East on the SE side of Monroe near the Lebanon Correctional Institute (LCI).  As I looked out my window (dri,12/12/2009,39.4402778,-84.3622222
1904,9/5/2009 21:40,hendersonville,nc,us,changing,90.0,about 1.5 minutes,Possible UFO sighting over Hendersonville&#44 NC,12/12/2009,35.318611100000005,-82.4611111
1905,9/5/2010 00:00,raleigh,nc,us,circle,7200.0,2 hours,we saw 2 objects in the sky one night flashing colors and not moving.  ((NUFORC Note:  Possible &quot;twinkling&quot; star&#44 we suspect.  PD)),11/21/2010,35.771944399999995,-78.63888890000001
1906,9/5/2010 01:45,kalama,wa,us,unknown,10.0,10 secs,Objects seen on clear night sky 30 miles north of Portland&#44 Oregon.,11/21/2010,46.0086111,-122.84333329999998
1907,9/5/2010 02:15,dartmouth (canada),ns,ca,oval,18000.0,1. 5 hr,Sunday Sept 6 2010  Dartmouth Nova Scotia  I woke up at around 2 am and decided to have a smoke after using the washroom. I leaned out,11/21/2010,44.666667,-63.566667
1908,9/5/2010 03:53,hanover park,il,us,triangle,420.0,5-7 minutes,7 ufo triangles HUGE over hanover park&#44 then stopped in mid air and rotated lights to look like constelations&#33,11/21/2010,41.999444399999994,-88.145
1909,9/5/2010 13:30,reed&#39s beach,nj,,rectangle,3.0,2-3 seconds,The shadow of a UFO passed over us under a clear blue sky.,11/21/2010,39.116909,-74.890966
1910,9/5/2010 14:00,alantic highlands,nj,,oval,2.0,2 seconds,I was reviewing the pictures i took today.  I notice one picture that looked like a ufo.  I wonder if your experts can analyze this to,11/21/2010,40.407886,-74.034306
1911,9/5/2010 16:00,bear,de,us,sphere,30.0,30 seconds then 30 second,a round metallic object flying over bear del. disappeared and reappeared changed direction and flew away at incredible speed,11/21/2010,39.6291667,-75.65861109999999
1912,9/5/2010 17:00,beverly hills,ca,us,light,900.0,15 min,6-8 lights flying in formations above LOS ANGELES,11/21/2010,34.0736111,-118.39944440000001
1913,9/5/2010 18:35,wells,me,us,fireball,240.0,4 minutes,Orange soundless object sceen in night sky above southern costal Maine town in early September 2010.,11/21/2010,43.32194439999999,-70.58138890000001
1914,9/5/2010 19:00,auburn,wa,us,light,900.0,15min,Two bright lights flying circles around each other,11/21/2010,47.3075,-122.2272222
1915,9/5/2010 20:00,clarksvile,tn,,light,1205.0,20:05,We just would like to know what that was.,11/21/2010,36.529771000000004,-87.359453
1916,9/5/2010 20:50,north tonawanda,ny,us,triangle,1200.0,20 min,4 objects appeared in the eastern sky approx 30 degrees above the horizon near jupiters position at the time.they were very bright as t,11/21/2010,43.038611100000004,-78.8644444
1917,9/5/2010 20:56,pensacola,fl,us,light,60.0,1 minute,I saw a slow moving light that went out&#44 and then a bit later came back on&#44 and then went  It was traveling north&#44 high up and slow.,11/21/2010,30.421111100000005,-87.2169444
1918,9/5/2010 21:00,desert hot springs,ca,us,triangle,3.0,3 seconds,Wedge-triangle shape transparent  dark cloud with entrails following movement.West to East over foothills of Joshua Tree,11/21/2010,33.961111100000004,-116.50083329999998
1919,9/5/2010 21:24,elkhorn,wi,us,unknown,40.0,40 seconds,Orange light travels in straight trajectory north over county fair in Wisconsin.,11/21/2010,42.6727778,-88.5444444
1920,9/5/2010 21:30,fort wright,ky,us,fireball,600.0,10 minutes,Orange orb over Cincinnati,11/21/2010,39.0516667,-84.5341667
1921,9/5/2010 21:40,cincinnati,oh,us,egg,4.0,4 seconds,During the WEBN 2010 Fireworks show a bright white light flys directly thourgh the show and was recorded on my dvr.,11/21/2010,39.161944399999996,-84.4569444
1922,9/5/2010 21:50,grass valley,ca,us,sphere,300.0,5 minutes,Two objects flying in formation.,11/21/2010,39.2191667,-121.06
1923,9/5/2010 22:00,thornville,oh,us,formation,180.0,2-3 minutes,10-12 hoovering balls of light,1/31/2011,39.8963889,-82.4202778
1924,9/5/2010 23:00,rochester,ny,us,circle,45.0,45 sec,Orange circular light &#44 it hovered for a time before moving away at a high rate of speed,11/21/2010,43.1547222,-77.61583329999999
1925,9/5/2010 23:50,aitkin,mn,us,fireball,60.0,1minnute,Glowing in the tree line was an amazing aluminous orange fireball .,11/21/2010,46.533055600000004,-93.71
1926,9/5/2011 00:10,plonevez du faou (france),,,circle,1800.0,30 minutes,bright white light movement,10/10/2011,48.253243,-3.825407
1927,9/5/2011 00:30,pocatello,id,us,light,900.0,15 minutes,Not quite a satellite.,10/10/2011,42.8713889,-112.4447222
1928,9/5/2011 00:45,baytown,tx,us,unknown,180.0,3 minutes,Three large bright lights in the sky&#44 unexplainable.,10/10/2011,29.7352778,-94.9772222
1929,9/5/2011 01:00,seattle,wa,us,light,60.0,1 minute,Eight orange lights appeared over downtown Seattle and then disappeared.,10/10/2011,47.6063889,-122.33083329999998
1930,9/5/2011 01:00,portland,or,us,light,5.0,5 seconds,bright light that looked like a satellite then shoots straight up leaving a streak behind momentarily,10/10/2011,45.523611100000004,-122.675
1931,9/5/2011 04:00,juxtlahuaca (mexico),,,oval,2.0,few seconds,flying flourescent lighted object that change directions fast.,10/10/2011,16.892335,-99.823453
1932,9/5/2011 06:30,miami,fl,us,circle,20.0,20 sec,Bright light splits in two,10/10/2011,25.7738889,-80.1938889
1933,9/5/2011 12:18,eugene,or,us,light,2.0,1-2 seconds,Bright fast moving light,10/10/2011,44.0522222,-123.08555559999999
1934,9/5/2011 20:30,rockford,il,us,light,90.0,1.5 minutes,Bright orange object seen over Rockford&#44 IL&#44 many witnesses.,10/10/2011,42.271111100000006,-89.09388890000001
1935,9/5/2011 20:45,columbus,oh,us,unknown,120.0,2 minutes,Set of bright lights close together (as if on one craft)&#44 stationary in sky&#44 and then dart southward and disappear.,10/10/2011,39.961111100000004,-82.99888890000001
1936,9/5/2011 21:25,copperas cove,tx,us,triangle,30.0,30 seconds,Triangle shaped craft with six lights flying silently at approx 250 mph at 550 ft traveling north to south.,10/10/2011,31.123888899999997,-97.9027778
1937,9/5/2011 21:45,lakeville,mn,us,fireball,300.0,4-5 mins,Red light object in the Minnesota sky,10/10/2011,44.6497222,-93.2425
1938,9/5/2011 22:30,riverside,ca,us,light,4.0,4 seconds,White dot flying at high speed on Labor Day evening in Riverside&#44 CA,10/10/2011,33.9533333,-117.39527779999999
1939,9/5/2011 23:50,morgan hill,ca,us,sphere,300.0,5 min,Sphere changing color and slowly darted around,10/10/2011,37.1305556,-121.65333329999999
1940,9/5/2012 00:46,ellensburg,wa,us,triangle,180.0,3 minutes,Bright yellow orbs in a triangular formation with blue and red lights flying close to the ground in Ellensburg&#44 WA,9/24/2012,46.9966667,-120.54666670000002
1941,9/5/2012 01:00,saugus,ca,us,disk,600.0,10 minutes,It showed up and disappeared then left,10/30/2012,34.4113889,-118.53916670000001
1942,9/5/2012 04:00,fountain valley,ca,us,oval,30.0,30 seconds,It was a freaky experiance and I hope nothing happend to us during the visual,9/24/2012,33.709166700000004,-117.95277779999999
1943,9/5/2012 05:30,springfield,mo,us,formation,600.0,10 minutes,Looked like a Helicopter but made no sound&#44 flying very low&#44 very bright lights that made a haze&#44 electronic interference.,9/24/2012,37.2152778,-93.2980556
1944,9/5/2012 05:30,kelso,wa,us,oval,6.0,5-6 seconds,I was in my car at a local business waiting for the replenishing crew. Looking at the stars I noticed what looked like a satellite movi,9/24/2012,46.146944399999995,-122.9072222
1945,9/5/2012 06:30,lee,nh,us,light,300.0,5 minutes,Orb-like lights in or on West Mill Pond at dawn,9/24/2012,43.1230556,-71.0119444
1946,9/5/2012 20:24,miller place,ny,us,diamond,90.0,90 seconds,Bright white object with flashing red and blue lights seen over Miller Place&#44 New York.,9/24/2012,40.9597222,-72.9966667
1947,9/5/2012 21:00,duluth,ga,us,other,480.0,8 minutes,Bright yellow lights moved up and down in a zig-zag spiraling motion then disappeared.,9/24/2012,34.0027778,-84.1447222
1948,9/5/2012 21:00,hurricane,wv,us,triangle,360.0,6 minutes,Large triangle red lights seen by many,9/24/2012,38.4325,-82.02027779999999
1949,9/5/2012 22:30,indianapolis,in,us,unknown,4.0,4 seconds,Large falling object that doesn&#39t make a sound.,9/24/2012,39.7683333,-86.1580556
1950,9/5/2012 23:10,auburn,wa,us,chevron,120.0,2 minutes,Objects raised out of the east there were 2 bright orange lights that were chevron or circular in shape,9/24/2012,47.3075,-122.2272222
1951,9/5/2013 00:00,advance,nc,us,diamond,420.0,5-7 minutes,UFO traveling north-south flys over rural farm area slowly and silently.,9/9/2013,35.9411111,-80.4094444
1952,9/5/2013 02:00,lincoln,ne,us,sphere,3600.0,1 hour,Hovered in the sky with flashing lights.,9/9/2013,40.8,-96.66666670000001
1953,9/5/2013 05:30,kings mountain,nc,us,other,60.0,one minute,&quot;T-Shaped&quot; lighted craft travels North-South across sky at low altitude&#44 makes very soft&#44 hollow whistling noise&#44 sky flashes.,9/9/2013,35.245,-81.34138890000001
1954,9/5/2013 07:16,hunt valley,md,us,sphere,60.0,1 minute,Shiny sphere seen over 83 south at Hunt Valley&#44 MD 9/5/2013 at 7:16am.,9/9/2013,39.4997222,-76.64138890000001
1955,9/5/2013 09:50,susanville,ca,us,cigar,300.0,4-5 minutes,It turned sideways while still moving in the same direction.,9/9/2013,40.416388899999994,-120.65194440000002
1956,9/5/2013 11:30,denver,co,us,disk,2.0,2 seconds,Ufo shoofing thru the sky during a national broadcadt. (NFL) 9/5/13.,9/9/2013,39.7391667,-104.98416670000002
1957,9/5/2013 12:00,advance,nc,us,triangle,420.0,5-7 minutes,Diamond craft looks like a very large bright red star then flys over us with blinking multicolored lights on stroke of midnight.,9/9/2013,35.9411111,-80.4094444
1958,9/5/2013 18:00,gilbert,az,us,unknown,5.0,5 seconds,Tiny cluster of white orbs one by one quickly appearing a disappearing. So close together it may have looked like one object.,9/9/2013,33.3527778,-111.78833329999999
1959,9/5/2013 19:00,gallatin,tn,us,circle,1800.0,30 minutes,Circular objects&#44 bright&#44 reflective&#44 appearing then vanishing.,9/9/2013,36.3883333,-86.44666670000001
1960,9/5/2013 20:00,los banos,ca,us,triangle,300.0,5 minutes,Lighted object hovering over lonely country road.,9/30/2013,37.0583333,-120.84888889999999
1961,9/5/2013 20:00,whittier,ca,us,circle,300.0,5 minutes,2 Large round red pulsating objects in the sky appeared to be on fire.  Seen by 5 people in Whittier&#44 CA.,9/9/2013,33.9791667,-118.03194440000001
1962,9/5/2013 20:25,bellingham,ma,us,circle,25.0,25 seconds,Large Red dot traveling north to south 3x plane beacon size.,9/9/2013,42.0866667,-71.475
1963,9/5/2013 20:30,cary,nc,us,circle,2700.0,45 minutes,Bright glowing circular object south of Raleigh Durham Airport in Cary&#44 NC.,9/9/2013,35.791388899999994,-78.78138890000001
1964,9/5/2013 20:30,sacramento,ca,us,changing,600.0,~10 minutes,Bright white pulsating light&#44 changing in shape and color (white&#44 red&#44 and blue).,9/9/2013,38.5816667,-121.49333329999999
1965,9/5/2013 21:00,easton,pa,us,fireball,180.0,2-3 minutes,Round object high in sky with flames coming from it.,9/9/2013,40.6883333,-75.22111109999999
1966,9/5/2013 21:00,emerald isle,nc,us,circle,120.0,2 minutes,Emerald Isle orange lights.,9/9/2013,34.6777778,-76.95111109999999
1967,9/5/2013 21:00,everett,wa,us,triangle,60.0,~1 min,All week long&#44 multiple sightings&#44 orange/red/green with stop and go flight patterns,9/30/2013,47.9791667,-122.20083329999999
1968,9/5/2013 21:00,hayden,al,us,unknown,300.0,5 minutes,Approx. 21:00 hrs seen two lights very close together with lights(white&amp;red) blinking left to right in odd sequence unknown shape.,9/9/2013,33.8925,-86.7577778
1969,9/5/2013 21:00,merrill,or,us,flash,14400.0,4 hours,White flashes of light over mountains in Southern Oregon.,9/9/2013,42.0252778,-121.59944440000001
1970,9/5/2013 22:00,fairbanks,ak,us,disk,300.0,5 minutes,HUGE SAUCER FLYING INTO FORT WAINRIGHT,9/30/2013,64.8377778,-147.7163889
1971,9/5/2013 22:00,pittsburgh,pa,us,unknown,60.0,1 minute,Three amber lights were moving slowly across the night sky of Pittsburgh a little before 10PM.,9/9/2013,40.4405556,-79.9961111
1972,9/5/2013 22:00,winnipeg (canada),mb,ca,sphere,120.0,2 minutes,Orange orb flying low.,9/9/2013,49.883333,-97.166667
1973,9/5/2013 22:20,boston,ny,us,oval,2.0,2 seconds,Bright light traveled quickly across sky.,9/9/2013,42.6288889,-78.73777779999999
1974,9/5/2013 22:30,shrewsbury,pa,us,circle,120.0,2 minute,Bright orange round light in sky moving slowly in a south to south west direction.,9/9/2013,39.7686111,-76.68
1975,9/5/2013 23:00,belgium,,,circle,6.0,6 seconds,Huge bright light in belgium moving over city TERNAT.,9/9/2013,50.503887,4.469936
1976,9/5/2013 23:00,springfield,ma,us,changing,300.0,5 minutes,It wasn&#39t a plane&#44 planes don&#39t hover.it wasn&#39t a helicopter either it was silent.,9/9/2013,42.101388899999996,-72.5902778
1977,9/5/2013 23:30,surfside beach,sc,us,disk,300.0,4-5 minutes,2 orange orbs seen in the night sky.,9/9/2013,33.6058333,-78.9733333
1978,9/5/2013 23:45,fairport,ny,us,oval,1200.0,20+ minutes,Flying orb of light casts an eerie silence.,9/9/2013,43.09861110000001,-77.4422222
1979,9/6/1966 21:00,pasco,wa,us,disk,120.0,2 min,I WAS WITH MY FGIFL FRIEND AND HER PARENTS AT A SMALL PICNIC GROUND NEAR PASCO WA.IT WAS ALREADY DARK OUT &#44 I WAS FACING NORTH SHE WAS,8/19/2000,46.2397222,-119.09944440000001
1980,9/6/1967 18:00,beatrice,ne,us,disk,120.0,1-2minutes,sighting of disc in Beatrice Nebraska,4/27/2004,40.268055600000004,-96.7466667
1981,9/6/1989 19:00,bellevue,wa,us,sphere,25.0,20-25 sec.,A huge Globe-shaped object is seen at very high altitude-stationary and soundless in the hazy&#44 evening sky of late summer,11/8/2003,47.610555600000005,-122.19944440000002
1982,9/6/1992 01:30,kamiah,id,us,circle,600.0,1o minutes??/,at first there were window size lights&#44 then a round lighted object&#44 then the round object by itself that shot from ground level to the,12/2/2000,46.2272222,-116.02833329999999
1983,9/6/1993 00:30,seattle,wa,us,triangle,6.0,6 seconds,lights over Seattle,9/9/2003,47.6063889,-122.33083329999998
1984,9/6/1994 02:00,brantford (canada),on,ca,light,10.0,10 weconds,strange light that flashed,10/27/2004,43.133333,-80.266667
1985,9/6/1995 01:30,stirling (uk/scotland),,gb,other,360.0,6 min,A colourfull cloud that kept turning in on it&#39self,8/20/2001,56.11666700000001,-3.95
1986,9/6/1995 21:30,grand canyon&#44 north rim,az,,light,0.5,1/2 second,While driving North on the only paved road out of the &quot;Grand Canyon&quot; national paark after veiwing the sunset there we saw a  very&#44 very,8/5/2000,36.231719,-113.030911
1987,9/6/1995 23:02,ashland,nh,us,cylinder,19800.0,5.5 hours,Breathable fluid tank; multiple species; peaceful agenda,12/2/2000,43.6952778,-71.6311111
1988,9/6/1996 20:00,lake shasta,ca,,light,120.0,1-2 min,Object speeds through night sky.,3/7/1998,40.743756,-122.40471299999999
